[
  {
    "data": {
      "argv": [
        "C:/Users/21441/.cache/codex-runtimes/codex-primary-runtime/dependencies/native/powershell/pwsh.exe",
        "-NoProfile",
        "-File",
        "H:/.codex/gui-handoffs/20261007-host-minimal/release-workers.ps1"
      ],
      "command_id": "C-b3a4a484-29b9-4b69-990f-8d5abfb16682",
      "cwd": ".",
      "secret_redaction_applied": false
    },
    "event_hash": "fdca6d35ef315a6b70cb55b131f3834fe084cd6e319fafceb46f66e34c2b5780",
    "event_type": "command_started",
    "previous_event_hash": "3205c54688eab7303103bc0fa48e1665732b05c714c96c57de89fc30db4d5c7a",
    "role": "coordinator",
    "run_id": "R-GUI-HOST-MIN-20261007",
    "schema_version": "1.0.0",
    "seq": 4,
    "task_id": "LOOP1-CLIENT-GUI-001",
    "timestamp": "2026-10-07T11:37:26.005649Z"
  },
  {
    "data": {
      "command_id": "C-b3a4a484-29b9-4b69-990f-8d5abfb16682",
      "duration_ms": 1500.5474,
      "exit_code": 0,
      "result": "PASS",
      "secret_redaction_applied": false,
      "stderr_blob": "blobs/C-b3a4a484-29b9-4b69-990f-8d5abfb16682.stderr.txt",
      "stderr_sha256": "e3b0c44298fc1c149afbf4c8996fb92427ae41e4649b934ca495991b7852b855",
      "stdout_blob": "blobs/C-b3a4a484-29b9-4b69-990f-8d5abfb16682.stdout.txt",
      "stdout_sha256": "5a4067b2104a1f410852fef99334ceada4a52663683fc2a2a1bf5f53b63d64b8"
    },
    "event_hash": "f7770d202a06a89fa62b77a6b9b0c52379b9abf1b3ad68e624d98e9fcc7716c8",
    "event_type": "command_finished",
    "previous_event_hash": "fdca6d35ef315a6b70cb55b131f3834fe084cd6e319fafceb46f66e34c2b5780",
    "role": "coordinator",
    "run_id": "R-GUI-HOST-MIN-20261007",
    "schema_version": "1.0.0",
    "seq": 5,
    "task_id": "LOOP1-CLIENT-GUI-001",
    "timestamp": "2026-10-07T11:37:27.508544Z"
  },
  {
    "data": {
      "argv": [
        "C:/Users/21441/.cache/codex-runtimes/codex-primary-runtime/dependencies/native/powershell/pwsh.exe",
        "-NoProfile",
        "-File",
        "H:/.codex/gui-handoffs/20261007-host-minimal/release-native.ps1"
      ],
      "command_id": "C-e2f4a658-4997-46c6-a11b-83591aed97c4",
      "cwd": ".",
      "secret_redaction_applied": false
    },
    "event_hash": "9033c5399ff169d0c2b7ccbe20a005104fe69a765f3bc5087f9102a64f318d63",
    "event_type": "command_started",
    "previous_event_hash": "f7770d202a06a89fa62b77a6b9b0c52379b9abf1b3ad68e624d98e9fcc7716c8",
    "role": "coordinator",
    "run_id": "R-GUI-HOST-MIN-20261007",
    "schema_version": "1.0.0",
    "seq": 6,
    "task_id": "LOOP1-CLIENT-GUI-001",
    "timestamp": "2026-10-07T11:38:24.357477Z"
  },
  {
    "data": {
      "command_id": "C-e2f4a658-4997-46c6-a11b-83591aed97c4",
      "duration_ms": 714.3473,
      "exit_code": 0,
      "result": "PASS",
      "secret_redaction_applied": false,
      "stderr_blob": "blobs/C-e2f4a658-4997-46c6-a11b-83591aed97c4.stderr.txt",
      "stderr_sha256": "e3b0c44298fc1c149afbf4c8996fb92427ae41e4649b934ca495991b7852b855",
      "stdout_blob": "blobs/C-e2f4a658-4997-46c6-a11b-83591aed97c4.stdout.txt",
      "stdout_sha256": "cf4a29dca72e0f16943bb9fc6b8c47b47ee5d1f97dc6f45162e830560a061800"
    },
    "event_hash": "8a693bbb25e29aa5632f63ebbd63e01be86b485368ff53b82a97c8f950f17f8d",
    "event_type": "command_finished",
    "previous_event_hash": "9033c5399ff169d0c2b7ccbe20a005104fe69a765f3bc5087f9102a64f318d63",
    "role": "coordinator",
    "run_id": "R-GUI-HOST-MIN-20261007",
    "schema_version": "1.0.0",
    "seq": 7,
    "task_id": "LOOP1-CLIENT-GUI-001",
    "timestamp": "2026-10-07T11:38:25.074519Z"
  },
  {
    "data": {
      "argv": [
        "C:/Users/21441/.cache/codex-runtimes/codex-primary-runtime/dependencies/python/python.exe",
        "-Xutf8",
        "-B",
        "H:/.codex/gui-handoffs/20261007-host-minimal/preserve-attempt.py"
      ],
      "command_id": "C-1df74001-8dc1-4135-b600-a7bfab763033",
      "cwd": ".",
      "secret_redaction_applied": false
    },
    "event_hash": "364d5115e7fb9a097513f3bbad88bc0c8a8e097f9499cdd8bbcb155059360e8c",
    "event_type": "command_started",
    "previous_event_hash": "8a693bbb25e29aa5632f63ebbd63e01be86b485368ff53b82a97c8f950f17f8d",
    "role": "coordinator",
    "run_id": "R-GUI-HOST-MIN-20261007",
    "schema_version": "1.0.0",
    "seq": 8,
    "task_id": "LOOP1-CLIENT-GUI-001",
    "timestamp": "2026-10-07T11:39:43.342841Z"
  }
]
